{
  "client": {
    "name": "semantic-kernel",
    "runtime": {
      "name": "python",
      "version": "3"
    },
    "version": "1.45.0"
  },
  "example": "semantic-kernel",
  "models": [
    "fast",
    "anthropic/claude-haiku-4-5",
    "openai/gpt-5.6-luna#low"
  ],
  "scenarios": [
    {
      "checks": [
        {
          "name": "answer contains pong",
          "ok": true
        },
        {
          "name": "finish_reason is stop",
          "ok": true
        },
        {
          "name": "usage present",
          "ok": true
        }
      ],
      "error": null,
      "id": "S1",
      "model": "fast",
      "note": null,
      "required": true,
      "status": "pass",
      "transcript": "transcripts/S1.fast.json"
    },
    {
      "checks": [
        {
          "name": "answer contains pong",
          "ok": true
        },
        {
          "name": "finish_reason is stop",
          "ok": true
        },
        {
          "name": "usage present",
          "ok": true
        }
      ],
      "error": null,
      "id": "S1",
      "model": "anthropic/claude-haiku-4-5",
      "note": null,
      "required": true,
      "status": "pass",
      "transcript": "transcripts/S1.anthropic-claude-haiku-4-5.json"
    },
    {
      "checks": [
        {
          "name": "answer contains pong",
          "ok": true
        },
        {
          "name": "finish_reason is stop",
          "ok": true
        },
        {
          "name": "usage present",
          "ok": true
        }
      ],
      "error": null,
      "id": "S1",
      "model": "openai/gpt-5.6-luna#low",
      "note": null,
      "required": true,
      "status": "pass",
      "transcript": "transcripts/S1.openai-gpt-5.6-luna-low.json"
    },
    {
      "checks": [],
      "error": "ServiceResponseException: (\"<class 'semantic_kernel.connectors.ai.open_ai.services.open_ai_chat_completion.OpenAIChatCompletion'> service failed to complete the prompt\", InternalServerError(\"Error code: 500 - {'error': {'message': 'scripted model has no answer for this prompt: What is the weather in Paris? Use the tool.', 'type': 'server_error', 'param': None, 'code': None}}\"))",
      "id": "S2",
      "model": "fast",
      "note": "Semantic Kernel sends the tool as weather-get_weather (plugin prefix); the scripted model answers only get_weather (#105)",
      "required": true,
      "status": "gap",
      "transcript": "transcripts/S2.fast.json"
    },
    {
      "checks": [],
      "error": "ServiceResponseException: (\"<class 'semantic_kernel.connectors.ai.open_ai.services.open_ai_chat_completion.OpenAIChatCompletion'> service failed to complete the prompt\", InternalServerError(\"Error code: 500 - {'error': {'message': 'scripted model has no answer for this prompt: What is the weather in Paris? Use the tool.', 'type': 'server_error', 'param': None, 'code': None}}\"))",
      "id": "S2",
      "model": "anthropic/claude-haiku-4-5",
      "note": "Semantic Kernel sends the tool as weather-get_weather (plugin prefix); the scripted model answers only get_weather (#105)",
      "required": true,
      "status": "gap",
      "transcript": "transcripts/S2.anthropic-claude-haiku-4-5.json"
    },
    {
      "checks": [],
      "error": "ServiceResponseException: (\"<class 'semantic_kernel.connectors.ai.open_ai.services.open_ai_chat_completion.OpenAIChatCompletion'> service failed to complete the prompt\", InternalServerError(\"Error code: 500 - {'error': {'message': 'scripted model has no answer for this prompt: What is the weather in Paris? Use the tool.', 'type': 'server_error', 'param': None, 'code': None}}\"))",
      "id": "S2",
      "model": "openai/gpt-5.6-luna#low",
      "note": "Semantic Kernel sends the tool as weather-get_weather (plugin prefix); the scripted model answers only get_weather (#105)",
      "required": true,
      "status": "gap",
      "transcript": "transcripts/S2.openai-gpt-5.6-luna-low.json"
    },
    {
      "checks": [
        {
          "name": "streamed text contains pong",
          "ok": true
        },
        {
          "name": "finish_reason is stop",
          "ok": true
        },
        {
          "name": "usage chunk present when requested",
          "ok": true
        },
        {
          "name": "stream ended normally",
          "ok": true
        }
      ],
      "error": null,
      "id": "S3",
      "model": "fast",
      "note": null,
      "required": true,
      "status": "pass",
      "transcript": "transcripts/S3.fast.json"
    },
    {
      "checks": [],
      "error": "ServiceResponseException: (\"<class 'semantic_kernel.connectors.ai.open_ai.services.open_ai_chat_completion.OpenAIChatCompletion'> service failed to complete the prompt\", InternalServerError(\"Error code: 500 - {'error': {'message': 'scripted model has no answer for this prompt: What is the weather in Paris? Use the tool.', 'type': 'server_error', 'param': None, 'code': None}}\"))",
      "id": "S4",
      "model": "fast",
      "note": "Semantic Kernel sends the tool as weather-get_weather (plugin prefix); the scripted model answers only get_weather (#105)",
      "required": true,
      "status": "gap",
      "transcript": "transcripts/S4.fast.json"
    }
  ],
  "schema": 1,
  "target": "scripted",
  "verdict": "partial"
}
