{
  "client": {
    "name": "google-genai",
    "runtime": {
      "name": "python",
      "version": "3"
    },
    "version": "2.31.0"
  },
  "date": "2026-10-16",
  "example": "gemini-python",
  "models": [
    "fast",
    "anthropic/claude-haiku-4-5",
    "openai/gpt-5.6-luna#low",
    "nope"
  ],
  "opencode": "2.0.29",
  "plugboard": {
    "commit": "v0.41.0-29-g2d6aac1",
    "version": "0.41.0"
  },
  "scenarios": [
    {
      "checks": [
        {
          "name": "answer contains pong",
          "ok": true
        },
        {
          "name": "finish_reason is stop",
          "ok": true
        },
        {
          "name": "usage present",
          "ok": true
        }
      ],
      "duration_ms": 623,
      "error": null,
      "id": "S1",
      "model": "fast",
      "note": null,
      "required": true,
      "status": "pass",
      "transcript": "transcripts/S1.fast.json"
    },
    {
      "checks": [
        {
          "name": "answer contains pong",
          "ok": true
        },
        {
          "name": "finish_reason is stop",
          "ok": true
        },
        {
          "name": "usage present",
          "ok": true
        }
      ],
      "duration_ms": 408,
      "error": null,
      "id": "S1",
      "model": "anthropic/claude-haiku-4-5",
      "note": null,
      "required": true,
      "status": "pass",
      "transcript": "transcripts/S1.anthropic-claude-haiku-4-5.json"
    },
    {
      "checks": [
        {
          "name": "answer contains pong",
          "ok": true
        },
        {
          "name": "finish_reason is stop",
          "ok": true
        },
        {
          "name": "usage present",
          "ok": true
        }
      ],
      "duration_ms": 2356,
      "error": null,
      "id": "S1",
      "model": "openai/gpt-5.6-luna#low",
      "note": null,
      "required": true,
      "status": "pass",
      "transcript": "transcripts/S1.openai-gpt-5.6-luna-low.json"
    },
    {
      "checks": [
        {
          "name": "turn 1 finish_reason is tool_calls",
          "ok": true
        },
        {
          "name": "one get_weather call",
          "ok": true
        },
        {
          "name": "city is Paris",
          "ok": true
        },
        {
          "name": "turn 2 mentions 18 or cloudy",
          "ok": true
        },
        {
          "name": "turn 2 finish_reason is stop",
          "ok": true
        }
      ],
      "duration_ms": 1955,
      "error": null,
      "id": "S2",
      "model": "fast",
      "note": "not checked, call id present: Gemini function calls carry no id (Google's API); the call is paired with its result by name, so there is nothing to check",
      "required": true,
      "status": "pass",
      "transcript": "transcripts/S2.fast.json"
    },
    {
      "checks": [
        {
          "name": "turn 1 finish_reason is tool_calls",
          "ok": true
        },
        {
          "name": "one get_weather call",
          "ok": true
        },
        {
          "name": "city is Paris",
          "ok": true
        },
        {
          "name": "turn 2 mentions 18 or cloudy",
          "ok": true
        },
        {
          "name": "turn 2 finish_reason is stop",
          "ok": true
        }
      ],
      "duration_ms": 1521,
      "error": null,
      "id": "S2",
      "model": "anthropic/claude-haiku-4-5",
      "note": "not checked, call id present: Gemini function calls carry no id (Google's API); the call is paired with its result by name, so there is nothing to check",
      "required": true,
      "status": "pass",
      "transcript": "transcripts/S2.anthropic-claude-haiku-4-5.json"
    },
    {
      "checks": [
        {
          "name": "turn 1 finish_reason is tool_calls",
          "ok": true
        },
        {
          "name": "one get_weather call",
          "ok": true
        },
        {
          "name": "city is Paris",
          "ok": true
        },
        {
          "name": "turn 2 mentions 18 or cloudy",
          "ok": true
        },
        {
          "name": "turn 2 finish_reason is stop",
          "ok": true
        }
      ],
      "duration_ms": 3684,
      "error": null,
      "id": "S2",
      "model": "openai/gpt-5.6-luna#low",
      "note": "not checked, call id present: Gemini function calls carry no id (Google's API); the call is paired with its result by name, so there is nothing to check",
      "required": true,
      "status": "pass",
      "transcript": "transcripts/S2.openai-gpt-5.6-luna-low.json"
    },
    {
      "checks": [
        {
          "name": "streamed text contains pong",
          "ok": true
        },
        {
          "name": "finish_reason is stop",
          "ok": true
        },
        {
          "name": "usage chunk present when requested",
          "ok": true
        },
        {
          "name": "stream ended normally",
          "ok": true
        }
      ],
      "duration_ms": 569,
      "error": null,
      "id": "S3",
      "model": "fast",
      "note": null,
      "required": true,
      "status": "pass",
      "transcript": "transcripts/S3.fast.json"
    },
    {
      "checks": [
        {
          "name": "finish_reason is tool_calls",
          "ok": true
        },
        {
          "name": "streamed get_weather call",
          "ok": true
        },
        {
          "name": "city is Paris",
          "ok": true
        }
      ],
      "duration_ms": 990,
      "error": null,
      "id": "S4",
      "model": "fast",
      "note": "not checked, call id present: Gemini function calls carry no id (Google's API); the call is paired with its result by name, so there is nothing to check",
      "required": true,
      "status": "pass",
      "transcript": "transcripts/S4.fast.json"
    },
    {
      "checks": [
        {
          "name": "answer says red",
          "ok": true
        }
      ],
      "duration_ms": 551,
      "error": null,
      "id": "S5",
      "model": "fast",
      "note": null,
      "required": true,
      "status": "pass",
      "transcript": "transcripts/S5.fast.json"
    },
    {
      "checks": [
        {
          "name": "answer says red",
          "ok": true
        }
      ],
      "duration_ms": 434,
      "error": null,
      "id": "S5",
      "model": "anthropic/claude-haiku-4-5",
      "note": null,
      "required": true,
      "status": "pass",
      "transcript": "transcripts/S5.anthropic-claude-haiku-4-5.json"
    },
    {
      "checks": [
        {
          "name": "answer says red",
          "ok": true
        }
      ],
      "duration_ms": 1308,
      "error": null,
      "id": "S5",
      "model": "openai/gpt-5.6-luna#low",
      "note": null,
      "required": true,
      "status": "pass",
      "transcript": "transcripts/S5.openai-gpt-5.6-luna-low.json"
    },
    {
      "checks": [
        {
          "name": "calories is a number",
          "ok": true
        },
        {
          "name": "protein_g is a number",
          "ok": true
        },
        {
          "name": "no extra keys",
          "ok": true
        }
      ],
      "duration_ms": 2066,
      "error": null,
      "id": "S6",
      "model": "fast",
      "note": null,
      "required": true,
      "status": "pass",
      "transcript": "transcripts/S6.fast.json"
    },
    {
      "checks": [
        {
          "name": "calories is a number",
          "ok": true
        },
        {
          "name": "protein_g is a number",
          "ok": true
        },
        {
          "name": "no extra keys",
          "ok": true
        }
      ],
      "duration_ms": 925,
      "error": null,
      "id": "S6",
      "model": "anthropic/claude-haiku-4-5",
      "note": null,
      "required": true,
      "status": "pass",
      "transcript": "transcripts/S6.anthropic-claude-haiku-4-5.json"
    },
    {
      "checks": [
        {
          "name": "calories is a number",
          "ok": true
        },
        {
          "name": "protein_g is a number",
          "ok": true
        },
        {
          "name": "no extra keys",
          "ok": true
        }
      ],
      "duration_ms": 3116,
      "error": null,
      "id": "S6",
      "model": "openai/gpt-5.6-luna#low",
      "note": null,
      "required": true,
      "status": "pass",
      "transcript": "transcripts/S6.openai-gpt-5.6-luna-low.json"
    },
    {
      "checks": [
        {
          "name": "fast listed",
          "ok": true
        },
        {
          "name": "claude listed",
          "ok": true
        },
        {
          "name": "gpt low variant listed",
          "ok": true
        }
      ],
      "duration_ms": 31,
      "error": null,
      "id": "S7",
      "model": "-",
      "note": null,
      "required": true,
      "status": "pass",
      "transcript": "transcripts/S7.none.json"
    },
    {
      "checks": [
        {
          "name": "status is 401",
          "ok": true
        }
      ],
      "duration_ms": 10,
      "error": null,
      "id": "E1",
      "model": "fast",
      "note": "not checked, code is invalid_api_key: Google's error body names the status UNAUTHENTICATED, not invalid_api_key; the status 401 is checked",
      "required": false,
      "status": "pass",
      "transcript": "transcripts/E1.fast.json"
    },
    {
      "checks": [
        {
          "name": "status is 404",
          "ok": true
        }
      ],
      "duration_ms": 47,
      "error": null,
      "id": "E2",
      "model": "nope",
      "note": "not checked, code is model_not_found: Google's error body names the status NOT_FOUND, not model_not_found; the status 404 is checked",
      "required": false,
      "status": "pass",
      "transcript": "transcripts/E2.nope.json"
    }
  ],
  "schema": 1,
  "target": "live",
  "verdict": "pass"
}
