{
  "client": {
    "name": "@ai-sdk/anthropic",
    "runtime": {
      "name": "bun",
      "version": "1"
    },
    "version": "4.0.81"
  },
  "date": "2026-10-16",
  "example": "vercel-ai-sdk-anthropic",
  "models": [
    "fast",
    "anthropic/claude-haiku-4-5",
    "openai/gpt-5.6-luna#low",
    "nope"
  ],
  "opencode": "2.0.29",
  "plugboard": {
    "commit": "8ef91b5",
    "version": "0.37.0"
  },
  "scenarios": [
    {
      "checks": [
        {
          "name": "answer contains pong",
          "ok": true
        },
        {
          "name": "finish_reason is stop",
          "ok": true
        },
        {
          "name": "usage present",
          "ok": true
        }
      ],
      "duration_ms": 1186,
      "error": null,
      "id": "S1",
      "model": "fast",
      "note": null,
      "required": true,
      "status": "pass",
      "transcript": "transcripts/S1.fast.json"
    },
    {
      "checks": [
        {
          "name": "answer contains pong",
          "ok": true
        },
        {
          "name": "finish_reason is stop",
          "ok": true
        },
        {
          "name": "usage present",
          "ok": true
        }
      ],
      "duration_ms": 505,
      "error": null,
      "id": "S1",
      "model": "anthropic/claude-haiku-4-5",
      "note": null,
      "required": true,
      "status": "pass",
      "transcript": "transcripts/S1.anthropic-claude-haiku-4-5.json"
    },
    {
      "checks": [
        {
          "name": "answer contains pong",
          "ok": true
        },
        {
          "name": "finish_reason is stop",
          "ok": true
        },
        {
          "name": "usage present",
          "ok": true
        }
      ],
      "duration_ms": 1512,
      "error": null,
      "id": "S1",
      "model": "openai/gpt-5.6-luna#low",
      "note": null,
      "required": true,
      "status": "pass",
      "transcript": "transcripts/S1.openai-gpt-5.6-luna-low.json"
    },
    {
      "checks": [
        {
          "name": "turn 1 finish_reason is tool_calls",
          "ok": true
        },
        {
          "name": "one get_weather call",
          "ok": true
        },
        {
          "name": "city is Paris",
          "ok": true
        },
        {
          "name": "call id present",
          "ok": true
        },
        {
          "name": "turn 2 mentions 18 or cloudy",
          "ok": true
        },
        {
          "name": "turn 2 finish_reason is stop",
          "ok": true
        }
      ],
      "duration_ms": 3301,
      "error": null,
      "id": "S2",
      "model": "fast",
      "note": null,
      "required": true,
      "status": "pass",
      "transcript": "transcripts/S2.fast.json"
    },
    {
      "checks": [
        {
          "name": "turn 1 finish_reason is tool_calls",
          "ok": true
        },
        {
          "name": "one get_weather call",
          "ok": true
        },
        {
          "name": "city is Paris",
          "ok": true
        },
        {
          "name": "call id present",
          "ok": true
        },
        {
          "name": "turn 2 mentions 18 or cloudy",
          "ok": true
        },
        {
          "name": "turn 2 finish_reason is stop",
          "ok": true
        }
      ],
      "duration_ms": 1929,
      "error": null,
      "id": "S2",
      "model": "anthropic/claude-haiku-4-5",
      "note": null,
      "required": true,
      "status": "pass",
      "transcript": "transcripts/S2.anthropic-claude-haiku-4-5.json"
    },
    {
      "checks": [
        {
          "name": "turn 1 finish_reason is tool_calls",
          "ok": true
        },
        {
          "name": "one get_weather call",
          "ok": true
        },
        {
          "name": "city is Paris",
          "ok": true
        },
        {
          "name": "call id present",
          "ok": true
        },
        {
          "name": "turn 2 mentions 18 or cloudy",
          "ok": true
        },
        {
          "name": "turn 2 finish_reason is stop",
          "ok": true
        }
      ],
      "duration_ms": 4029,
      "error": null,
      "id": "S2",
      "model": "openai/gpt-5.6-luna#low",
      "note": null,
      "required": true,
      "status": "pass",
      "transcript": "transcripts/S2.openai-gpt-5.6-luna-low.json"
    },
    {
      "checks": [
        {
          "name": "streamed text contains pong",
          "ok": true
        },
        {
          "name": "finish_reason is stop",
          "ok": true
        },
        {
          "name": "usage chunk present when requested",
          "ok": true
        },
        {
          "name": "stream ended normally",
          "ok": true
        }
      ],
      "duration_ms": 1162,
      "error": null,
      "id": "S3",
      "model": "fast",
      "note": null,
      "required": true,
      "status": "pass",
      "transcript": "transcripts/S3.fast.json"
    },
    {
      "checks": [
        {
          "name": "finish_reason is tool_calls",
          "ok": true
        },
        {
          "name": "streamed get_weather call",
          "ok": true
        },
        {
          "name": "city is Paris",
          "ok": true
        },
        {
          "name": "call id present",
          "ok": true
        }
      ],
      "duration_ms": 1927,
      "error": null,
      "id": "S4",
      "model": "fast",
      "note": null,
      "required": true,
      "status": "pass",
      "transcript": "transcripts/S4.fast.json"
    },
    {
      "checks": [
        {
          "name": "answer says red",
          "ok": true
        }
      ],
      "duration_ms": 810,
      "error": null,
      "id": "S5",
      "model": "fast",
      "note": null,
      "required": true,
      "status": "pass",
      "transcript": "transcripts/S5.fast.json"
    },
    {
      "checks": [
        {
          "name": "answer says red",
          "ok": true
        }
      ],
      "duration_ms": 537,
      "error": null,
      "id": "S5",
      "model": "anthropic/claude-haiku-4-5",
      "note": null,
      "required": true,
      "status": "pass",
      "transcript": "transcripts/S5.anthropic-claude-haiku-4-5.json"
    },
    {
      "checks": [
        {
          "name": "answer says red",
          "ok": true
        }
      ],
      "duration_ms": 1863,
      "error": null,
      "id": "S5",
      "model": "openai/gpt-5.6-luna#low",
      "note": null,
      "required": true,
      "status": "pass",
      "transcript": "transcripts/S5.openai-gpt-5.6-luna-low.json"
    },
    {
      "checks": [
        {
          "name": "calories is a number",
          "ok": true
        },
        {
          "name": "protein_g is a number",
          "ok": true
        },
        {
          "name": "no extra keys",
          "ok": true
        }
      ],
      "duration_ms": 2627,
      "error": null,
      "id": "S6",
      "model": "fast",
      "note": null,
      "required": true,
      "status": "pass",
      "transcript": "transcripts/S6.fast.json"
    },
    {
      "checks": [],
      "duration_ms": 3,
      "error": "AI_APICallError: output_config.format: structured outputs are not supported",
      "id": "S6",
      "model": "anthropic/claude-haiku-4-5",
      "note": "plugboard refuses output_config.format on /v1/messages (docs/messages.md) (#102)",
      "required": true,
      "status": "gap",
      "transcript": "transcripts/S6.anthropic-claude-haiku-4-5.json"
    },
    {
      "checks": [
        {
          "name": "calories is a number",
          "ok": true
        },
        {
          "name": "protein_g is a number",
          "ok": true
        },
        {
          "name": "no extra keys",
          "ok": true
        }
      ],
      "duration_ms": 3947,
      "error": null,
      "id": "S6",
      "model": "openai/gpt-5.6-luna#low",
      "note": null,
      "required": true,
      "status": "pass",
      "transcript": "transcripts/S6.openai-gpt-5.6-luna-low.json"
    },
    {
      "checks": [
        {
          "name": "fast listed",
          "ok": true
        },
        {
          "name": "claude listed",
          "ok": true
        },
        {
          "name": "gpt low variant listed",
          "ok": true
        }
      ],
      "duration_ms": 6,
      "error": null,
      "id": "S7",
      "model": "-",
      "note": null,
      "required": true,
      "status": "pass",
      "transcript": "transcripts/S7.none.json"
    },
    {
      "checks": [
        {
          "name": "status is 401",
          "ok": true
        },
        {
          "name": "code is invalid_api_key",
          "ok": false
        }
      ],
      "duration_ms": 11,
      "error": null,
      "id": "E1",
      "model": "fast",
      "note": "Messages errors use Anthropic's error.type, not an error.code (#102)",
      "required": false,
      "status": "gap",
      "transcript": "transcripts/E1.fast.json"
    },
    {
      "checks": [
        {
          "name": "status is 404",
          "ok": true
        },
        {
          "name": "code is model_not_found",
          "ok": false
        }
      ],
      "duration_ms": 4,
      "error": null,
      "id": "E2",
      "model": "nope",
      "note": "Messages errors use Anthropic's error.type, not an error.code (#102)",
      "required": false,
      "status": "gap",
      "transcript": "transcripts/E2.nope.json"
    }
  ],
  "schema": 1,
  "target": "live",
  "verdict": "partial"
}
