{
  "client": {
    "name": "openai",
    "runtime": {
      "name": "python",
      "version": "3.13"
    },
    "version": "3.29.0"
  },
  "date": "2026-10-12",
  "example": "openai-python",
  "models": [
    "fast",
    "anthropic/claude-haiku-4-5",
    "openai/gpt-5.6-luna#low",
    "nope"
  ],
  "plugboard": {
    "commit": "a38860b",
    "version": "0.24.0"
  },
  "scenarios": [
    {
      "checks": [
        {
          "name": "answer contains pong",
          "ok": true
        },
        {
          "name": "finish_reason is stop",
          "ok": true
        },
        {
          "name": "usage present",
          "ok": true
        }
      ],
      "duration_ms": 968,
      "error": null,
      "id": "S1",
      "model": "fast",
      "note": null,
      "required": true,
      "status": "pass",
      "transcript": "transcripts/S1.fast.json"
    },
    {
      "checks": [
        {
          "name": "answer contains pong",
          "ok": true
        },
        {
          "name": "finish_reason is stop",
          "ok": true
        },
        {
          "name": "usage present",
          "ok": true
        }
      ],
      "duration_ms": 633,
      "error": null,
      "id": "S1",
      "model": "anthropic/claude-haiku-4-5",
      "note": null,
      "required": true,
      "status": "pass",
      "transcript": "transcripts/S1.anthropic-claude-haiku-4-5.json"
    },
    {
      "checks": [
        {
          "name": "answer contains pong",
          "ok": true
        },
        {
          "name": "finish_reason is stop",
          "ok": true
        },
        {
          "name": "usage present",
          "ok": true
        }
      ],
      "duration_ms": 1819,
      "error": null,
      "id": "S1",
      "model": "openai/gpt-5.6-luna#low",
      "note": null,
      "required": true,
      "status": "pass",
      "transcript": "transcripts/S1.openai-gpt-5.6-luna-low.json"
    },
    {
      "checks": [
        {
          "name": "turn 1 finish_reason is tool_calls",
          "ok": true
        },
        {
          "name": "one get_weather call",
          "ok": true
        },
        {
          "name": "city is Paris",
          "ok": true
        },
        {
          "name": "call id present",
          "ok": true
        },
        {
          "name": "turn 2 mentions 18 or cloudy",
          "ok": true
        },
        {
          "name": "turn 2 finish_reason is stop",
          "ok": true
        }
      ],
      "duration_ms": 1352,
      "error": null,
      "id": "S2",
      "model": "fast",
      "note": null,
      "required": true,
      "status": "pass",
      "transcript": "transcripts/S2.fast.json"
    },
    {
      "checks": [
        {
          "name": "turn 1 finish_reason is tool_calls",
          "ok": true
        },
        {
          "name": "one get_weather call",
          "ok": true
        },
        {
          "name": "city is Paris",
          "ok": true
        },
        {
          "name": "call id present",
          "ok": true
        },
        {
          "name": "turn 2 mentions 18 or cloudy",
          "ok": true
        },
        {
          "name": "turn 2 finish_reason is stop",
          "ok": true
        }
      ],
      "duration_ms": 1832,
      "error": null,
      "id": "S2",
      "model": "anthropic/claude-haiku-4-5",
      "note": null,
      "required": true,
      "status": "pass",
      "transcript": "transcripts/S2.anthropic-claude-haiku-4-5.json"
    },
    {
      "checks": [
        {
          "name": "turn 1 finish_reason is tool_calls",
          "ok": true
        },
        {
          "name": "one get_weather call",
          "ok": true
        },
        {
          "name": "city is Paris",
          "ok": true
        },
        {
          "name": "call id present",
          "ok": true
        },
        {
          "name": "turn 2 mentions 18 or cloudy",
          "ok": true
        },
        {
          "name": "turn 2 finish_reason is stop",
          "ok": true
        }
      ],
      "duration_ms": 4274,
      "error": null,
      "id": "S2",
      "model": "openai/gpt-5.6-luna#low",
      "note": null,
      "required": true,
      "status": "pass",
      "transcript": "transcripts/S2.openai-gpt-5.6-luna-low.json"
    },
    {
      "checks": [
        {
          "name": "streamed text contains pong",
          "ok": true
        },
        {
          "name": "finish_reason is stop",
          "ok": true
        },
        {
          "name": "usage chunk present when requested",
          "ok": true
        },
        {
          "name": "stream ended with [DONE]",
          "ok": true
        }
      ],
      "duration_ms": 1557,
      "error": null,
      "id": "S3",
      "model": "fast",
      "note": null,
      "required": true,
      "status": "pass",
      "transcript": "transcripts/S3.fast.json"
    },
    {
      "checks": [
        {
          "name": "finish_reason is tool_calls",
          "ok": true
        },
        {
          "name": "streamed get_weather call",
          "ok": true
        },
        {
          "name": "city is Paris",
          "ok": true
        },
        {
          "name": "call id present",
          "ok": true
        }
      ],
      "duration_ms": 680,
      "error": null,
      "id": "S4",
      "model": "fast",
      "note": null,
      "required": true,
      "status": "pass",
      "transcript": "transcripts/S4.fast.json"
    },
    {
      "checks": [
        {
          "name": "answer says red",
          "ok": true
        }
      ],
      "duration_ms": 602,
      "error": null,
      "id": "S5",
      "model": "fast",
      "note": null,
      "required": true,
      "status": "pass",
      "transcript": "transcripts/S5.fast.json"
    },
    {
      "checks": [
        {
          "name": "answer says red",
          "ok": true
        }
      ],
      "duration_ms": 571,
      "error": null,
      "id": "S5",
      "model": "anthropic/claude-haiku-4-5",
      "note": null,
      "required": true,
      "status": "pass",
      "transcript": "transcripts/S5.anthropic-claude-haiku-4-5.json"
    },
    {
      "checks": [
        {
          "name": "answer says red",
          "ok": true
        }
      ],
      "duration_ms": 2059,
      "error": null,
      "id": "S5",
      "model": "openai/gpt-5.6-luna#low",
      "note": null,
      "required": true,
      "status": "pass",
      "transcript": "transcripts/S5.openai-gpt-5.6-luna-low.json"
    },
    {
      "checks": [
        {
          "name": "calories is a number",
          "ok": true
        },
        {
          "name": "protein_g is a number",
          "ok": true
        },
        {
          "name": "no extra keys",
          "ok": true
        }
      ],
      "duration_ms": 4933,
      "error": null,
      "id": "S6",
      "model": "fast",
      "note": null,
      "required": true,
      "status": "pass",
      "transcript": "transcripts/S6.fast.json"
    },
    {
      "checks": [
        {
          "name": "calories is a number",
          "ok": true
        },
        {
          "name": "protein_g is a number",
          "ok": true
        },
        {
          "name": "no extra keys",
          "ok": true
        }
      ],
      "duration_ms": 6115,
      "error": null,
      "id": "S6",
      "model": "anthropic/claude-haiku-4-5",
      "note": null,
      "required": true,
      "status": "pass",
      "transcript": "transcripts/S6.anthropic-claude-haiku-4-5.json"
    },
    {
      "checks": [
        {
          "name": "calories is a number",
          "ok": true
        },
        {
          "name": "protein_g is a number",
          "ok": true
        },
        {
          "name": "no extra keys",
          "ok": true
        }
      ],
      "duration_ms": 11070,
      "error": null,
      "id": "S6",
      "model": "openai/gpt-5.6-luna#low",
      "note": null,
      "required": true,
      "status": "pass",
      "transcript": "transcripts/S6.openai-gpt-5.6-luna-low.json"
    },
    {
      "checks": [
        {
          "name": "fast listed",
          "ok": true
        },
        {
          "name": "claude listed",
          "ok": true
        },
        {
          "name": "gpt low variant listed",
          "ok": true
        }
      ],
      "duration_ms": 24,
      "error": null,
      "id": "S7",
      "model": "-",
      "note": null,
      "required": true,
      "status": "pass",
      "transcript": "transcripts/S7.none.json"
    },
    {
      "checks": [
        {
          "name": "status is 401",
          "ok": true
        },
        {
          "name": "code is invalid_api_key",
          "ok": true
        }
      ],
      "duration_ms": 3,
      "error": null,
      "id": "E1",
      "model": "fast",
      "note": null,
      "required": false,
      "status": "pass",
      "transcript": "transcripts/E1.fast.json"
    },
    {
      "checks": [
        {
          "name": "status is 404",
          "ok": true
        },
        {
          "name": "code is model_not_found",
          "ok": true
        }
      ],
      "duration_ms": 111,
      "error": null,
      "id": "E2",
      "model": "nope",
      "note": null,
      "required": false,
      "status": "pass",
      "transcript": "transcripts/E2.nope.json"
    }
  ],
  "schema": 1,
  "target": "live",
  "verdict": "pass"
}
